,Title,Abstract,Accept
30,Assessment of the changing levels of livelihood assets in the Kampong Phluk community with implications for community-based ecotourism,"In recent years, international attention has been rendered to development of ecotourism for poverty reduction and biodiversity conservation. We assessed local livelihood assets in Kampong Phluk Community before and after the introduction of the community-based ecotourism (CBET) governance system, where it was previously under the private company management system (SEAPAC). We used a sustainable livelihood framework to assess natural, physical, human, social, and financial assets by analyzing a set of panel data of 150 observations according to the scoring scale of zero (total dissatisfaction) to one (total satisfaction). We found that full implementation of CBET raised the overall average score of livelihood assets by 0.15. In particular, physical capital and human capital achieved remarkable growth by 0.25 to 0.23, respectively, while growth in natural capital and financial capital was statistically insignificant. Although CBET showed promising results, improving communication and providing community health care would motivate active participation in ecotourism development. © 2020 Elsevier Ltd",NA
31,"Loco or no loco? Holocene climatic fluctuations, human demography, and community based management of coastal resources in Northern Chile","The abundance of the southern Pacific mollusk loco (Concholepas concholepas), among other conspicuous marine supplies, are often cited as critical resources behind the long-term cultural and demographic fluctuations of prehistoric hunter-gatherers in the coastal Atacama Desert. These societies inhabited one of the world’s most productive marine environments flanked by one the world’s driest deserts. Both of these environments have witnessed significant ecological variation since people first colonized themat the end of the Pleistocene (c. 13,000 cal yr BP). Here, we examine the relationship between the relative abundance of shellfish (a staple resource) along a 9,500-year sequence of archeological shell midden accumulations at Caleta (a small inlet or cove) Vitor, with past demographic trends (established via summed probability distributions of radiocarbon ages) and technological innovations together with paleoceanographic data on past primary productivity. We find that shellfish extraction varied considerably from one cultural period to the next in terms of the number of species and their abundance, with diversity increasing during periods of regionally decreased productivity. Such shifts in consumption patterns are considered community based management decisions, and for the most part they were synchronous with large and unusual regional demographic fluctuations experienced by prehistoric coastal societies in northern Chile. When taken together with their technological innovations, our data illustrates how these human groups tailored their socio-cultural patterns to what were often abrupt and prolonged environmental changes throughout the Holocene. © 2017 Wagner, Ding and Jaffé.",NA
32,Multi-scale policy diffusion and translation in Pacific Island coastal fisheries,"Multilateral consensus forged among heads of states must be value-additive and relevant at the national level to facilitate on-ground implementation. Yet, despite general optimism and advances in policy understanding, multi-scale diffusion remains a challenge with little certainty in outcomes. This study focuses on examining intermediary dynamics occurring within national policy apparatus that can influence domestic uptake of policy innovation. We analyse the anticipated spread of two supranational policies on coastal fisheries in the Pacific region – the 'small-Scale Fisheries Guidelines’ and ‘the New Song’ – in three countries: Kiribati, Solomon Islands and Vanuatu. Our approach combines instrumental perspectives on ‘policy coherence’ with cognitive–normative perspectives on ‘policy image’. Accordingly, we use two methods: a document-based comparison of the policies produced at different levels and interviews with national government officers in charge of policy deliberation and delivery. We find supranational-to-national policy coherence across most prescribed policy themes, except for emergent social themes such as ‘gender’ and ‘human rights–based approaches’. The views of government managers substantiate, and further augment, this finding. Crucially, managers' images (encompassing judgements, aspirations and convictions) represent personal and practical attributes involved in policy interpretation and implementation. Multi-scale policy diffusion is thus a translational process mediated by national-level staff, and managers' policy images offer nuanced and dynamic insights into why some policies are slow to take root while others take different shape to their agreed meanings. Analysts and policymakers must consider and mobilise translational approaches and policy images in order to understand and facilitate successful domestic implementation of international agreements. © 2018 Elsevier Ltd",NA
33,A revolution in management?,"Since 1998, the State of California has taken dramatic steps to reform its management of activities affecting marine wildlife. The passage of the Marine Life Management Act in 1998 and the Marine Life Protection Act in 1999, as well as the initiation of a community-based process to establish marine reserves at the Channel Islands mirror policy changes at the national level. This paper focuses on the general historical background for these changes and on the passage and early implementation of the Marine Life Management Act (MLMA). After briefly discussing the Marine Life Protection Act (MLPA) and the Channel Islands marine reserves process, the paper evaluates progress in implementing reform, and identifies challenges for the future.",NA
34,"Assessment of ecological vulnerability to climate variability on coastal fishing communities: A study of Ungwana Bay and Lower Tana Estuary, Kenya","Fisheries resources are important in supporting the livelihood of many coastal communities especially in the developing tropical countries. Fisheries resources however, continue to face unprecedented pressure from the impacts of climate change, and this presents both ecological and socio-economic challenges to the dependent communities. This paper assessed the ecological vulnerability to climate variability of artisanal fishing communities in Ungwana Bay and the Lower Tana Delta in Kenya, using selected fin fish species. A combination of approaches were adopted and used to identify and determine exposure, sensitivity, and adaptation indicators. These included a critical review of existing literature, socio-economic survey, and computation of temperature and rainfall variation using long term data from 1983 to 2015. The method of Equal Weights (EW) was applied to all indicators after normalization. The data was normalized in a scale of 0–1, where 0 indicated low vulnerability level and 1 high vulnerability. By using composite index, the selected Ngomeni and Ozi fishing communities within the larger Ungwana Bay and Lower Tana Delta indicated high levels of vulnerability of 0.9 and 0.8 respectively. Due to high vulnerability level and poor adaptation capacity by the local fishing communities in the selected study sites, we recommend government and non-governmental agencies to reinforce community based organizations (CBOs) activities on ecological conservation and social network creation to promote short and long term adaptation measures. © 2018 Elsevier Ltd",NA
35,The Ghosts of Fisheries Management,"The scientific analysis and management of fisheries has been dominated by three institutional orthodoxies: state regulation, market exchange and community-based management. This paper argues that these static, substantive, metaphors obscure a consideration of the dynamic temporal interplay between stakeholders and their environment. To address this vacuity the paper outlines a process-sociological approach and applies it to the historical development of fisheries management in the Tam Giang Lagoon, in Central Vietnam. The analysis shows that the interplay between different groups of fishers, the Vietnamese state, and the lagoon environment, over time, structures future struggles. As such, this interplay needs to be understood as a causal force of its own in the development of fisheries management. Endorsement of the analysis raises important questions concerning the potential of policy and planning to control fisheries. © 2012 Copyright Taylor and Francis Group, LLC.",NA
36,Adaptive capacity of marine comanagement: a comparative analysis of the influence of colonial legacies and integrated traditional governance on outcomes in the Pacific,"Integrating traditional institutions into marine resource comanagement has become common across the Pacific. However, these arrangements can link village-based and centralized governance systems in many ways, resulting in new hybridized institutional organizations, operational scales, and governance process. Examining the context-specific social, cultural, and historical processes that shape these programs can reveal how systems for comanagement develop, and how institutional differences influence adaptive capacity. Using analytical tools drawn from critical institutionalism and broad institutional perspectives, we assess how different institutional histories and processes of hybridization informed the adaptive capacity of two comanagement programs in Samoa: the Community-Based Fisheries Management Programme (CBFMP) and the Marine Protected Area (MPA) program. While the programs were embedded in similar cultural and ecological contexts, the MPA program became inactive following the 2009 Pacific tsunami, while the CBFMP endured. In spite of early efforts to involve communities in the MPA program’s development, the institutional history and organization of the program’s managing agency informed an interpretation of comanagement principles that did not adequately incorporate traditional Samoan institutions for coastal management, reducing its adaptive capacity. In contrast, the CBFMP gained resilience through its fundamental integration with village-based social and political institutions, social norms, and values. This analysis of institutional histories, structures, and program outcomes demonstrates that colonial legacies pose obstacles for successful hybridized governance in the Pacific, while also confirming the valuable contributions integrated traditional institutions can make to improving adaptive capacity. © 2021, The Author(s), under exclusive licence to Springer-Verlag GmbH, DE part of Springer Nature.",NA
37,"Neoliberalization, decentralization and community-based natural resources management in Malawi: The first sixteen years and looking ahead","This article reviews the paradoxical gap between theory/policy and reality from 16 years of community-based natural resources management (CBNRM) in Malawi's fisheries, forestry and wildlife sectors, focusing on influences of imported neoliberal blueprints. The article argues that CBNRM has created shifting institutional hybridities melding neoliberal principles and modern institutions with neo-patrimonial institutions, producing more challenges than opportunities. Recent gains and bias toward revenue generation have not been matched by practical measures for ecological sustainability. Synthesis of trends, challenges, lessons and opportunities through an institutional choice lens contributes to understanding of relative costs and benefits of CBNRM in delivering ecological and socio-economic goals. © 2012 SAGE Publications.",NA
38,Lessons for modern management from the South Pacific,"A traditional Pacific islands coastal resource management system is a community-based, participatory system for the integrated management of both land and sea. It is an expression of social relationships between people, expressed as rights to exploit resources. It is an area in which traditional or customary fishing rights are exercised as part of a land-sea area which a particular group, related through kinship, collectively owns. There may be another group associated with that ""primary' group which has rights of use in the area. These rights are bound by unwritten management rules. Traditional South Pacific islander fisheries management systems have long included many progressive elements of ""western' fisheries management, including limited entry; seasonal, spatial, gear, size, and species restrictions; prior appropriation rights; and the concept of sole ownership, among others. However, they may lack some of the features necessary for management for sustainable development. -from Author",NA
39,Fisheries Management: Progress Towards Sustainability,"The world's stocks of wild fish continue to decline, making the task of finding innovative, sustainable and socially acceptable methods of fisheries management more important than ever. Several new approaches from around the world have proved to be successful in stemming the decline whilst increasing fish catches, and under the editorship of McClanahan and Castilla this international team of authors have looked to these examples to provide the reader with carefully chosen case studies offering practical suggestions and solutions for problem fisheries elsewhere. Coverage includes: Community based fisheries. Collaborative and co-operative fisheries management. Coastal fisheries management. The future for sustainable fisheries management. Written by many of the world's most experienced practitioners Fisheries Management: Progress toward sustainability is an important purchase for all fisheries scientists, managers and conservationists. All libraries in universities and research establishments where this area is studied and taught will find this book a valuable addition to their shelves. © 2007 by Blackwell Publishing Ltd.",NA
40,"The nature-culture boundary and ocean policy: Great Barrier Island, New Zealand","This article analyzes New Zealand's rights-based system of fisheries management from the perspective of local stakeholders on northern Great Barrier Island. The research identified differing perspectives through use of the concept of ""boundary construction,"" not only in terms of society and nature but also among societal institutions. Great Barrier Island participants exhibited significant differences, especially between staff of the local Department of Conservation and local Maori, both of whom were engaged in negotiating policy implementation at the local level. These differences expressed themselves in conceptions of both societal boundaries - the scale at which community was envisioned - and conceptions of the boundary between nature and culture. The findings confirm the need for the continued development of models of community-based resource management as well as for the conceptual integration of society and nature in the realm of policy construction. Copyright © 2007 by the American Geographical Society of New York.",NA
41,Classification of coastal communities reporting commercial fish landings in the U.S. Northeast region: Developing and testing a methodology,"The National Marine Fisheries Service is required by law to conduct social impact assessments of communities impacted by fishery management plans. To facilitate this process, we developed a technique for grouping communities based on common sociocultural attributes. Multivariate data reduction techniques (e.g. principal component analyses, cluster analyses) were used to classify Northeast U.S. fishing communities based on census and fisheries data. The comparisons indicate that the clusters represent real groupings that can be verified with the profiles. We then selected communities representative of different values on these multivariate dimensions for in-depth analysis. The derived clusters are then compared based on more detailed data from fishing community profiles. Ground-truthing (e.g. visiting the communities and collecting primary information) a sample of communities from three clusters (two overlapping geographically) indicates that the more remote techniques are sufficient for typing the communities for further in-depth analyses. The in-depth analyses provide additional important information which we contend is representative of all communities within the cluster.",NA
42,Fijian villagers adapt to changes in local fisheries,"This paper analyzes some of the problems encountered by a village-run fishing cooperative in rural Fiji. Concern about the limited success of this fishing cooperative led the villagers of Kaba Point. Fiji to ask for biological and socioeconomic studies to determine the roots of the cooperative's problems. The villagers also required an assessment of their proposal to revitalize the cooperative through a development scheme that would enable them to increase their catch. The surveys, undertaken by researchers from the University of the South Pacific and the Fiji Fisheries Division, indicate that the area has been overfished, primarily through the widespread local and commercial use of gillnets and the reliance on fishing as a sole source of village income, and further expansion of the current resource exploitation patterns would be very damaging. In addition, although the cooperative provides an important sense of communalism in the village, only a few people regularly provide fish to the coop. The semi-subsistence lifestyle of rural Fiji is one factor limiting villagers participation in full-time fishing activities. The traditional social and management structures inherent in this village (especially, marine tenure, chiefly responsibility for the community, and a demonstrated history of communal projects) can form a strong basis for a modern community-based marine management program. However, if not carefully watched, resources can also be locally mismanaged because of the increasing demands of the modern market-driven economy.This paper analyzes some of the problems encountered by a village-run fishing cooperative in rural Fiji. Concern about the limited success of this fishing cooperative led the villagers of Kaba Point, Fiji to ask for biological and socioeconomic studies to determine the roots of the cooperative's problems. The villagers also required an assessment of their proposal to revitalize the cooperative through a development scheme that would enable them to increase their catch. The surveys, undertaken by researchers from the University of the South Pacific and the Fiji Fisheries Division, indicate that the area has been overfished, primarily through the widespread local and commercial use of gillnets and the reliance on fishing as a sole source of village income, and further expansion of the current resource exploitation patterns would be very damaging. In addition, although the cooperative provides an important sense of communalism in the village, only a few people regularly provide fish to the coop. The semi-subsistence lifestyle of rural Fiji is one factor limiting villagers participation in full-time fishing activities. The traditional social and management structures inherent in this village (especially, marine tenure, chiefly responsibility for the community, and a demonstrated history of communal projects) can form a strong basis for a modern community-based marine management program. However, if not carefully watched, resources can also be locally mismanaged because of the increasing demands of the modern market-driven economy.",NA
43,"Community‐based Fisheries Management, Tradition and the Challenges of Development in Marovo, Solomon Islands","This study examines traditional fisheries‐related resource management through a case in which local communities, from a basis of customary, ‘common property’ control over the sea and its resources, handle a multitude of development issues. Presenting first some important issues relating to people's role in fisheries management and to the ‘common property’ debate, the article then describes a traditional system for management of land and sea resources in a Pacific Islands society; that of Marovo Lagoon, Solomon Islands. Emphasis is given to fisheries resources, with a view to explaining in practical terms how a system of customary marine tenure operates under the wider social, political, economic and ecological circumstances of change arising from development pressures. Against this background, assessments are made of the viability of this traditional fisheries management system under present conditions of state control and of both external and internal pressures for large‐scale resource development enterprises. © 1994 Institute of Social Studies",NA
44,"Management of traditional common fishing grounds: The experience of the para community, indonesia","The experience of the Para fishing community in managing its traditional fishing commons is explored. The concepts, methods, challenges to survive, and transformations in the direction of traditional community-based management in coastal fisheries are documented. Some lessons can be extracted from the Para experience that may be useful as an additional perspective in governing new management regimes for sustainable use of fishing commons. Evidence at Para shows that the fishers themselves founded the basis of management, erected an effective organization, constructed the equity share principle, invented and enforced regulations, and meted out the punishments. The delegation of authority in the local community to establish their sea tenure system is considered as a pivotal element in the management of communal property resources. © 1996 Taylor & Francis.",NA
45,Evaluation of the Impact of a Pharmacist-Led Telehealth Clinic on Diabetes-Related Goals of Therapy in a Veteran Population,"Objectives Telemedicine has been offered as a way to ensure that all patients, including those who live in rural areas, have access to the same health care. This study was performed to evaluate the benefit of a real-time, clinic-based video telehealth (Clinical Video Telehealth [CVT]) program and the impact of a pharmacist-led CVT clinic for chronic disease state management. The primary objective was to evaluate changes from baseline values, in veterans referred by primary care providers to this clinic. Methods This was a single-center, prospective, pre-post pilot study that also included a post-patient satisfaction survey. The study was conducted at the Tennessee Valley Healthcare System, which is composed of two medical centers and 12 community-based outpatient clinics (CBOCs) located away from the two main facilities. Fifteen clinical pharmacy specialists (CPSs) - seven at the two main facilities and eight at the CBOCs - provide disease state management clinical pharmacy services. One of the seven CPSs at the main facilities works via telemedicine and provides services to the CBOCs where on-site clinical pharmacy services did not exist. The primary outcomes were changes from baseline in A1C, LDL level, systolic blood pressure, and diastolic blood pressure after 6 months of CVT services by the CPS. Secondary outcomes were the percentages of patients meeting American Diabetes Association treatment goals for hemoglobin A1c (A1C), low-density lipoprotein level, and blood pressure, both individually and in combination after attending a pharmacist-led CVT program; the level of patient satisfaction with pharmacists' care and with CVT as a method of receiving chronic disease management, specifically for diabetes; and medication additions or changes made by the pharmacist. Results Twenty-six patients completed the 6-month evaluation. A significant decrease in A1C of 2% from baseline was observed (p=0.0002), and the percentage of patients meeting goal A1C significantly increased from 0% at baseline to 38% at 6 months (p=0.0007). Overall patient satisfaction scores were also high, with a median score 39.5 (interquartile range 36-40) of a maximum score of 40. Conclusion Six months of CVT clinic attendance significantly improved A1C values and the overall percentage of patients meeting their goal A1C values in this veteran population. In addition, patient satisfaction scores also indicated a high level of satisfaction with the pharmacist-led CVT service. © Published 2016. This article is a U.S. Government work and is in the public domain in the USA.",NA
