,Title,Abstract,Accept
46,Modeling short-term fishing dynamics in a small-scale intertidal shellfishery,"We assessed the relative contribution of a set of predictors on the short-term dynamics of the yellow clam intertidal fishery in Uruguay based on a community-based data collection program for five consecutive fishing seasons. Results of generalized linear mixed models showed that the occurrence of fishable days depends on the absence of red tide events and prevailing wind conditions, but also was related to the timing of each fishing event throughout the fishing season. Furthermore, higher fishing yields were coincident with the prevalence of northerly offshore winds. Catch per unit of effort levels of each fishing event were mostly related to interannual characteristics of each fishing season and, to a lesser extent, with fisher attributes (gender and age) and the timing of each fishing event. The adverse effect of red tides and unfavorable environmental conditions impose a high degree of uncertainty in this social-ecological system, leading to economic inefficiency. A key challenge for successful management of the yellow clam fishery and other similar small-scale fisheries relies in considering not only the resource and the governance subsystems, but also the dynamics of the resource users, together with relevant external drivers affecting them. © 2018 Elsevier B.V.",NA
47,Long-Term Stability of the Faunal Community of a Subtropical Estuary: Evaluating Disturbances in the Context of Interannual Variability,"Estuarine and coastal marine ecosystems can have significant intra- and interannual variability in faunal community structure, complicating management response to disturbances as disturbance effects must be detectable within normal variability and on timescales relevant to management entities. We examined a long-term, multi-gear dataset on estuarine faunal (fish and select invertebrate) communities to determine if community structure changes due to disturbances could be detected on management-relevant timescales (e.g., years), given that these communities have known seasonal and interannual variability. Results from multivariate, community-based analyses, and several univariate diversity indices for fauna of Tampa Bay, Florida, USA suggested general community stability over the long term, with the exceptions of 2005–2006 (prolonged red tide event) and 2010 (extreme cold event in winter). Community structure was notably outside the typical variability for both time periods. In 2005, species richness decreased by half for one gear type and was the lowest on record for the other two gear types. In 2010, when the relative abundance of a top predator decreased by 50% from cold-related mortality, Simpson’s diversity index was the lowest on record for one gear type. The red tide and extreme-cold events differed in duration and the number of taxa directly impacted (multispecies vs. single-species, respectively) but both multivariate and univariate analyses indicated significant deviation in the faunal community structure during these years. Within 1–3 years after these major events, however, the community seemed to have returned to a structure like that of previous years, suggesting long-term stability and resilience. Our results confirm that multivariate and univariate analyses can detect major disturbances to estuarine faunal communities, which gives management entities options for which analysis approach is appropriate for their needs. Since the Tampa Bay faunal communities recovered within 3 years, we suggest that where long-term monitoring exists, active restoration might be deferred while monitoring for signs of recovery following the removal of a perturbation. This is a fundamental part of sound adaptive management processes to promote sustainable ecosystems. © 2020, Coastal and Estuarine Research Federation.",NA
48,Exclusive economic zones and the management of fisheries in the South China Sea,"The 1982 United Nations Convention on the Law of the Sea (LOSC), with the provisions for defining an Exclusive Economic Zone (EEZ), is the international agreement that has had the greatest influence on the structure of fisheries policies in national and international arenas. It had the profound effect of increasing the contribution of fisheries to the national gross domestic product or GDP. It brought about a redistribution of benefits from fishing from distant water fishing fleets to the coastal states. Investments flowed in to the fisheries sector. Countries that had fisheries resources but limited capacity to exploit them established joint ventures with states that owned fishing fleets (ADB, 1997). The end result was a substantial increase in the contribution of fisheries to the national GDP especially in developing countries and the overall shift in total capture fisheries production from the developed to the developing world (Delgado et al., 2003). The LOSC and the EEZ are strongly associated with ownership and the implication that fisheries will be better managed within some property rights regime. These concepts were modified by coastal states to apply to fisheries management policies at the scale of local governments and even communities. Shortly after the Third United Nations Conference on the Law of the Sea ended in 1982, community-based initiatives to define fishing rights and effectively manage fisheries proliferated. There was a stronger effort to move national policy toward devolution of fisheries management to local government units and encourage co-management and stakeholder participation in the management of coastal resources. There were several efforts to develop Integrated Coastal Zone Management (ICZM) Plans and establish Community Based Coastal Resource Management (CBCRM) strategies in the Philippines first, and later in Indonesia, Thailand, Malaysia and Vietnam. In this paper, we present case studies where there is a poor institutional fit between the EEZs of coastal states and the natural structure of fisheries resources. This has led to the formulation of inadequate fisheries policies, difficulties in monitoring and controlling the overexploitation of fish stocks, and a massive degradation of fish habi tats vital to the survival and sustainability of stocks. In the first two decades of the LOSC, states have focused on implementing Articles 55-56 and 61-62, which detailed their jurisdiction and right to exploit resources optimally. In this next decade of implementing the LOSC, states will need to consider the provisions for transboundary cooperation detailed in Articles 63 to 67 of Part V of the LOSC. We highlight the importance of knowledge of institutional interplay in fisheries management at the local, sub-national, national and regional scales, and how this relates to the structure of fish stocks and national jurisdiction. We also suggest some research priorities and institutional adjustments required to increase the chances of devising a successful fisheries policy, embody a broader regional perspective of the needs and aspirations of fisheries, as well as national goals. The case studies presented are derived from the experiences of coastal states that border the South China Sea. © 2005 Springer. All Rights Reserved.",NA
49,Social dimensions of local fisheries co-management in the Coral Triangle,"SUMMARY The challenge to manage coastal resources within Asia-Pacific's Coral Triangle has gained global attention. Co-management is promoted as a key strategy to address this challenge. Contemporary community-based co-management often leads to 'hybridization' between local (customary) practices, and science-based management and conservation. However, the form of this hybrid has rarely been critically analysed. This paper presents examples of co-management practices in eastern Indonesia and Solomon Islands, focusing in particular on area closures. In contrast to the temporary closures used before the influx of sustainability discourses, contemporary closures are periodically-harvested but predominantly closed, reflecting attempts to reduce fishing effort and enhance ecological sustainability. When areas are opened, harvests are relatively short and largely triggered by the social and economic needs of particular individuals or whole communities. In all cases, engagement with environmental management interventions has led to more formalized access and use arrangements. The harvesting and management practices observed are influenced by these relatively recent interventions designed to promote sustainability, but also by religious institutions, increasing resource demand, and modernization. This study unpacks some of the contemporary influences, particularly environmental sustainability initiatives, on local management practices, and provides insights for co-management in practice. Copyright © Foundation for Environmental Conservation 2015.",NA
50,Facing limits in oceanic fisheries: Part I: Extent of the problem and policy responses,"Research from the Food and Agriculture Organization of the United Nations (FAO) and fishery scientists indicates that the wild catch offish and other marine life from the oceans will not be able to increase significantly in the future, except through rehabilitation and better management of stocks. Despite the limited potential for bigger catches, fishing fleets have expanded rapidly in recent decades under government subsidies. Fishers now have approximately twice the capacity necessary to make the annual catch from the oceans. The juxtaposition of natural limits and overinvestment has created a crisis situation for the world's fishers, fishing communities and traditional fishing cultures. Part I of this article discusses policy responses at the national and international level. How policy makers respond to the overextension of the marine fishing industry will determine the extent of job loss, hunger and dislocation that will result. Part II, to be published in the Forum's next issue (February 1995), will examine the social aspects of the world's fishing industry, including the demography of fishers, utilization of fisheries products, the relative social contribution of aquaculture and policy responses to overcapacity. Policy makers could enhance the social benefits of marine fisheries — both jobs and food — through a combination of government oversight and community based management. 1994 United Nations",NA
51,Madagascar Fish Eagle productivity in the Tsimembo-Manambolomaty Protected Area and surrounding habitat of western Madagascar,"We monitored the productivity of the critically endangered Madagascar Fish Eagle Haliaeetus vociferoides inside and outside of the Tsimembo-Manambolomaty Protected Area (T-M PA), western Madagascar from 2010 to 2015. We recorded 14 breeding pairs inside and 13 outside T-M PA. The T-M PA and surrounding habitat hosted respectively 10 and six breeding polyandrous pairs, composed of one adult female and two adult males. During the six-year study period, 101 eggs were laid in nests in T-M PA of which 60 hatched and 58 young fledged. We recorded 62 eggs laid in nests outside the T-M PA of which 39 hatched and 36 young fledged. Productivity was similar at both sites, inside and outside T-M PA, with 0.84 (58/69) and 0.76 (36/47) fledgling per nesting attempt and 0.69 (58/84) and 0.5 (36/72) fledglings per territorial pair, respectively. Polyandrous pairs have higher productivity compared with normal pairs. Threats to Madagascar Fish Eagles and their habitat were low due to the existence of a community-based resource management system called the Local Management Secured System (GELOSE) inside and outside the T-M PA. This system is based on strengthening local traditional customs and rules, and involving local people in managing their natural resources sustainably along with biodiversity conservation. © 2018 NISC (Pty) Ltd.",NA
52,Hidden benefits and risks of partial protection for coral reef fisheries,"Partially protected areas are now the dominant global form of spatial management aimed at preserving ecosystem integrity and managing human use. However, most evaluations of their efficacy use only a narrow set of conservation indicators that reflect a fraction of ways in which protection can succeed or fail. In this paper, we examine three case studies of partially protected coral reef fishery systems to evaluate benefits and risks of their use as a management tool. We use data from community-based management arrangements in three Pacific Island countries to demonstrate three vignettes of how partial protection can boost fisheries production, enhance the ease with which fishers catch their prey, and alter the composition of fisheries yields. These changes in fisheries productivity, catchability, and vulnerability under partial protection carry substantial benefits for fishers. However, they also carry significant risks for ecosystems and fisheries livelihoods unless adaptively managed so as to confer the short to medium term benefits in resource performance without risking longer term sustainability. © 2022 by the author(s). Published here under license by the Resilience Alliance.",NA
53,A theory of scaling for community-based fisheries management,"Community-based approaches to fisheries management has emerged as a mainstream strategy to govern dispersed, diverse and dynamic small scale fisheries. However, amplifying local community led sustainability outcomes remains an enduring challenge. We seek to fill a theoretical gap in the conceptualization of ‘scaling up community-based fisheries management’. We draw on literature of agriculture innovations to provide a framework that takes into account process-driven and structural change occurring across multiple levels of governance, as well as different phases of scaling. We hypothesize that successful scaling requires engagement with all aspects of a governing regime, coalescing a range of actors, and therefore, is an enterprise that is larger than its parts. To demonstrate where the framework offers value, we illustrate the development of community-based fisheries management in Vanuatu according to the framework’s main scaling dimensions. © 2021, The Author(s).",NA
54,Assessment of governance of fisher communities of inland openwater fisheries in Bangladesh,"The Community Based Fisheries Management (CBFM) with partnership arrangement of government, non-government organisations, fisher communities and other stakeholders has introduced community management of inland openwater fisheries in Bangladesh. This arrangement introduced CBFM approaches named fisher-led, community-led and women-led approach. One of the principles behind community based managed fisheries is to improve democratisation process of changing governance of fisheries aiming to manage their resources efficiently. The CBFM approach has made a significant contribution towards improvement of governance and democracy to fisher communities. Besides, a wider range of local institutional arrangements as community based organizations (CBOs) have been established through participatory process with legal entity. Now, there is practice of governance and democracy within CBOs and fisher communities. They are more efficient in participation of fisheries management. This paper presents and assesses the governance status of the fisher communities in inland openwater fisheries under co-management arrangement in Bangladesh. In summary, it might recommend at policy level to scale up community based fisheries approach to promote governance for better management with a long term commitment. © 2013 Elsevier Ltd.",NA
55,"Tonle Sap Lake, Cambodia: A perspective on its transborder hydrological and resources governance","Tonle Sap Lake is the largest freshwater lake in South East Asia, being situated at the heart of the Mekong River Basin. Governance of the lake over the recent past has been weak and overly complex, and the basin governance structure has changed over time in terms of its fisheries management framework. The governance framework initially focused on the commercial exploitation of fish resources, but has more recently switched to a community-based fisheries management, biodiversity conservation and open access model. This study discusses how the water flows occurring between the Mekong River and Tonle Sap Lake complicate the governance of the lake, and particularly its fisheries, biodiversity, land and water management activities. The establishment of the Tonle Sap Authority (TSA) in 2007 sought to address the governance challenges facing the lake. The current study concludes, however, that the TSA alone is not sufficient and that global, regional and national stakeholders must make an effort to ensure the water flows between the lake and the Mekong River are themselves considered a core governance issue for the Tonle Sap. © 2015 Wiley Publishing Asia Pty Ltd.",NA
56,The difference that class makes: Neoliberalization and non-capitalism in the fishing industry of new england,"Fishing economies are typically represented as pre-capitalist and as a barrier to capital accumulation rather than as an alternative economy with its own potentials. Privatization (and capitalism) appears logical and inevitable because ""there is no alternative"" described or given. The class analysis presented here focuses on questions of property and subjectivity and describes fishing as a non-capitalist and community-based economy consonant with both a tradition of common property and an image of ""fishermen"" as independent and interested in fairness and equity. While the latter is associated with a neoliberal subject aligned with the capitalist economy, a class analysis of fishing repositions ""fishermen"" as community subjects aligned with a community economy. © 2007 The Author Journal compilation © 2007 Editorial Board of Antipode.",NA
57,CROI 2016: Hot spots in HIV infection and advances in HIV prevention,"The 2016 Conference on Retroviruses and Opportunistic Infections (CROI) highlighted hot spots in HIV infection. Men who have sex with men (MSM), transgender populations, people who inject drugs, fisherfolk, migrants, adolescents, and older adults are heavily impacted in a number of regions. Stigma contributes to risk behaviors and HIV acquisition across populations. HIV testing is a crucial first step in the HIV care continuum, and several large community-based surveys are underway in Africa to increase HIV testing, linkage to care, and uptake of antiretroviral treatment. Advances in preexposure prophylaxis (PrEP) featured prominently at CROI 2016. Two large efficacy trials of a vaginal ring containing the investigational drug dapivirine demonstrated efficacy and safety in preventing HIV infections in women in Africa. Data on the safety of long-acting injectable PrEP and several investigational PrEP drugs and formulations were also presented. Knowledge and use of PrEP among MSM in the United States appears to be increasing, and high uptake was seen among black MSM when provided as part of a culturally tailored support program. The use of broadly neutralizing antibodies for HIV prevention is a novel and promising approach to be evaluated in efficacy trials. © 2016, IAS–USA. All rights reserved.",NA
58,Community involvement in fisheries management: Experiences in the Gulf of Thailand countries,"This paper examines the involvement of coastal communities in fisheries management among the countries of the Gulf of Thailand-Malaysia, Vietnam, Cambodia and Thailand. Initiatives to decentralize management to local governing bodies, to utilize traditional management methods and to engage in community agreements to protect local resources are explored. An examination of recent experiences indicates some movement toward more local involvement in management. However, the study also leads to several suggestions for the future: in Vietnam and Cambodia, there is a need for significant legislation to control fisheries operations and greater clarity of the role of communities in management; in Malaysia, there is an overall need for more support to local fisheries management; and in Thailand, the need is for greater support of local-level enforcement and monitoring activities. © 2009 Elsevier Ltd. All rights reserved.",NA
59,Community-based organic agriculture in the Philippines,"This paper explores institutional mechanisms that might be required to boost both organic agriculture and rural development in the Philippines. Special attention is paid to community-based organic agriculture as a pathway to rural development. The Philippines has two decades of experience of community-based natural resource management. Unlike public natural resources such as forests, watersheds or fisheries, however, the community-based organic agriculture programme is intended to deal with the private property regime. Thus, if the programme is to be successful, agrarian land reform must continue. Integrated rice- duck farming is among the suitable and viable options for organic agriculture, given that rice is a major agricultural crop and duck meat is popular in the Philippines. Area-based organic food certification systems need to be formulated and a government-farmers partnership should be forged to facilitate farmers' access to domestic and international organic food markets.",NA
60,Empowerment and institutions: Managing fisheries in Uganda,"The perception of communities as homogeneous and concern over representation and accountability of structures are key critiques of community-based natural resource management (CBNRM). A focus on understanding institutions that mediate access to, and control over, natural resources is seen as a way forward to improving management regimes that include local people. Experience in the implementation of integrated lake management in Uganda is drawn on to understand how institutions can be challenged to improve access to fisheries for marginalized stakeholders. Processes such as empowerment and the formation of accountable and representative structures are part of the way forward. © 2006 Elsevier Ltd. All rights reserved.",NA
61,"The fishery of sea-cucumber Holothuridae in Kilbat Village, Central Maluku Regency, Indonesia","Sea cumber is one of the valuable high economic resources. Worldwide, most sea cucumber fisheries are ineffectively managed, leading to declining stocks and potentially eroding the resilience of fisheries. The local fishermen of Kilbat Village have been exploiting sea cucumber for a long time with un-proper management pan. This study was aimed to investigate the utilization of sea cumber and assess its sustainability, and propose a sustainable management strategy. Field observation was used to analyze sea cucumber utilization, the Rapid appraisal to Fisheries (Rapfish) approach was used to assess its sustainability, whilst DPSIR was applied to perform a sustainable management strategy. The result shows that the local sea cucumber fishermen utilize sea cucumber as a source of income and self-consumption. The average sustainability was 61.17% of 100% sustainable scale and considered as fair sustain with institutional dimension being unsustain. There are 8 strategies proposed for sea cumber sustainable management with responses at D, P, S, and I level, A traditional indigenous knowledge (sasi) has been proposed for sea cucumber community-based fishery management. © Published under licence by IOP Publishing Ltd.",NA
62,A role for partially protected areas on coral reefs: Maintaining fish diversity?,"Completely banning fishing from coral reefs is now accepted to have significant benefits for marine biodiversity and in many cases, fisheries. However, the benefits of regulating fishing on coral reefs, by restricting the methods used, or the total amount of fishing, are less well understood, even though such regulations are much more likely to be supported by fishermen. This study assesses whether banning illegal, destructive fishing methods and reducing the numbers of fishermen visiting from outside an area benefits a coral reef fishery, despite unregulated fishing by local fishermen using non-destructive methods. The abundance, biomass, mean length, and species richness of nine commercially important fish families are compared across ten independent patch reefs inside and outside the 470km2 Menai Bay Conservation Area in Zanzibar, Tanzania. Even after taking into account the effect of differences in habitat and the distance between reefs, 61% (±19.7%) more fish species were found in regulated than unregulated reefs. Fish abundance, biomass, and length were not affected, suggesting that banning destructive fishing may improve biodiversity, but that further regulations may be required to improve fish stocks. © 2011 John Wiley &amp; Sons, Ltd.",NA
